[
  {
    "slug": "atari-system-1",
    "name": "Atari System 1",
    "manufacturer": "atari",
    "description": "Atari's first solid-state pinball platform, used from 1976 to 1978, built around a custom discrete-logic MPU without a traditional microprocessor. It debuted with The Atarians (1976) and was used on early titles like Time 2000 and Airborne Avenger. The system used a unique design that differed significantly from the Motorola 6800-based platforms favored by competitors.",
    "mpu_strings": [
      "Atari Generation/System 1"
    ]
  },
  {
    "slug": "atari-system-2",
    "name": "Atari System 2",
    "manufacturer": "atari",
    "description": "Atari's second-generation pinball platform, used from approximately 1977 to 1979, featuring a Motorola 6800 CPU. Games on this platform include Superman (1979) and Hercules (1979), the latter being the largest pinball machine ever mass-produced. The system introduced speech capability on some later titles.",
    "mpu_strings": [
      "Atari Generation/System 2"
    ]
  },
  {
    "slug": "atari-system-3",
    "name": "Atari System 3",
    "manufacturer": "atari",
    "description": "Atari's third and final pinball hardware generation, used from approximately 1979 to 1985, built around a 6502-family CPU. Notable titles include Road Runner (1979) and Space Invaders (1980). Atari exited the pinball business in 1985 after declining sales.",
    "mpu_strings": [
      "Atari Generation/System 3"
    ]
  },
  {
    "slug": "bally-as2518-17",
    "name": "Bally AS-2518-17",
    "manufacturer": "bally",
    "description": "Bally's first solid-state pinball MPU, introduced in 1977, based on the Motorola 6800 CPU. Used on early Bally solid-state games such as Freedom (1977) and Night Rider (1977). This board established Bally's entry into the solid-state era, replacing their earlier electromechanical designs.",
    "mpu_strings": [
      "Bally MPU AS-2518-17"
    ]
  },
  {
    "slug": "bally-as2518-35",
    "name": "Bally AS-2518-35",
    "manufacturer": "bally",
    "description": "An updated version of Bally's 6800-based MPU, used from approximately 1979 to 1981. This board added support for more complex game rules and additional hardware features over the -17 board. Notable games include Xenon (1980), one of the first pinball machines with synthesized speech, and Eight Ball Deluxe (1981).",
    "mpu_strings": [
      "Bally MPU AS-2518-35"
    ]
  },
  {
    "slug": "bally-as2518-133",
    "name": "Bally AS-2518-133",
    "manufacturer": "bally",
    "description": "A further revision of Bally's solid-state MPU line, used in the early 1980s, still based on the Motorola 6800 architecture. This board refined the earlier -35 design with cost reductions and reliability improvements.",
    "mpu_strings": [
      "Bally MPU AS-2518-133"
    ]
  },
  {
    "slug": "bally-6802",
    "name": "Bally 6802",
    "manufacturer": "bally",
    "description": "A Bally/Midway pinball platform from the early-to-mid 1980s using the Motorola 6802 processor, an evolution of the 6800 with onboard RAM. This transitional platform bridged the gap between Bally's original solid-state boards and the later 6803 system.",
    "mpu_strings": [
      "Bally MPU A080-91638-D000 (6802)"
    ]
  },
  {
    "slug": "bally-6803",
    "name": "Bally 6803",
    "manufacturer": "bally",
    "description": "Bally/Midway's mid-1980s pinball platform, based on the Motorola 6803 CPU, used from approximately 1985 to 1989. Notable titles include Cybernaut (1985), Escape from the Lost World (1987), and Blackwater 100 (1988). This was the last Bally-designed system before Williams acquired Bally/Midway.",
    "mpu_strings": [
      "Bally MPU A084-91786-AH06 (6803)"
    ]
  },
  {
    "slug": "capcom-a0015405",
    "name": "Capcom A0015405",
    "manufacturer": "capcom",
    "description": "Capcom's pinball MPU, used during their brief entry into pinball manufacturing from 1995 to 1996. Based on a Motorola 68000 CPU, it featured a dot-matrix display and stereo sound. Notable games include Pinball Magic (1995) and Big Bang Bar (1996). Capcom exited pinball after producing only a handful of titles.",
    "mpu_strings": [
      "Capcom A0015405"
    ]
  },
  {
    "slug": "cgc-pinball-controller-os",
    "name": "CGC Pinball Controller/OS",
    "manufacturer": "chicago-gaming",
    "description": "The proprietary hardware and operating system developed by Chicago Gaming Company for their recreation and remake pinball machines, including Medieval Madness Remake (2014), Attack from Mars Remake (2017), and Cactus Canyon Continued (2019). The system uses modern embedded processors to faithfully reproduce classic Williams WPC-era gameplay while adding new features and improved reliability.",
    "mpu_strings": [
      "CGC Pinball Controller/OS"
    ]
  },
  {
    "slug": "data-east-v1",
    "name": "Data East/Sega Version 1",
    "manufacturer": "data-east",
    "description": "Data East's first pinball hardware platform, introduced in 1987, based on the Motorola 6808 CPU. It featured an alphanumeric segmented display. Early titles include Laser War (1987), Data East's first pinball machine, and Secret Service (1988).",
    "mpu_strings": [
      "DataEast/Sega Version 1"
    ]
  },
  {
    "slug": "data-east-v2",
    "name": "Data East/Sega Version 2",
    "manufacturer": "data-east",
    "description": "Data East's second-generation platform, introduced around 1989, transitioning to a more capable processor and adding support for 128x16 dot-matrix displays. Notable games include Checkpoint (1991), one of the earliest DMD pinball machines, and Star Wars (1992).",
    "mpu_strings": [
      "DataEast/Sega Version 2"
    ]
  },
  {
    "slug": "data-east-v3",
    "name": "Data East/Sega Version 3",
    "manufacturer": "data-east",
    "description": "The third revision of the Data East pinball hardware, used in the early-to-mid 1990s, with an upgraded processor and enhanced sound capabilities. This platform was used on popular titles like Jurassic Park (1993), Last Action Hero (1993), and Tales from the Crypt (1993). It featured a 128x32 DMD.",
    "mpu_strings": [
      "DataEast/Sega Version 3"
    ]
  },
  {
    "slug": "data-east-v3b",
    "name": "Data East/Sega Version 3b",
    "manufacturer": "data-east",
    "description": "A minor revision of the Data East Version 3 hardware, used in the mid-1990s as the brand transitioned to Sega Pinball following Sega's acquisition of Data East's pinball division in 1994. Games on this platform include Maverick (1994) and Batman Forever (1995).",
    "mpu_strings": [
      "DataEast/Sega Version 3b"
    ]
  },
  {
    "slug": "day-one-d1psb",
    "name": "Day One D1PSB",
    "manufacturer": "day-one",
    "description": "A modern boutique pinball hardware platform produced by Day One Pinball, representing one of several small-batch pinball control systems that emerged during the 2010s indie pinball movement.",
    "mpu_strings": [
      "Day One D1PSB"
    ]
  },
  {
    "slug": "game-plan-mpu-1",
    "name": "Game Plan MPU-1",
    "manufacturer": "game-plan",
    "description": "Game Plan's first solid-state pinball MPU, used from approximately 1978 to 1980, based on the Motorola 6800 CPU. Game Plan was founded by former Genco/Chicago Coin personnel. Early titles include Sharpshooter (1979) and Old Coney Island! (1979).",
    "mpu_strings": [
      "Game Plan MPU-1"
    ]
  },
  {
    "slug": "game-plan-mpu-2",
    "name": "Game Plan MPU-2",
    "manufacturer": "game-plan",
    "description": "Game Plan's second-generation MPU, used from approximately 1981 to 1985. It offered expanded capabilities over the MPU-1 while retaining the 6800-family architecture. Notable games include Attila the Hun (1984) and Cyclopes (1985). Game Plan exited the pinball industry in the mid-1980s.",
    "mpu_strings": [
      "Game Plan MPU-2"
    ]
  },
  {
    "slug": "gottlieb-system-1",
    "name": "Gottlieb System 1",
    "manufacturer": "gottlieb",
    "description": "Gottlieb's first solid-state pinball system, introduced in 1977, based on the Rockwell PPS-4, a 4-bit microprocessor. It debuted with Cleopatra (1977) and was used on titles like Close Encounters of the Third Kind (1978) and Sinbad (1978). The unusual choice of a 4-bit CPU made these boards distinctive among competitors who favored 8-bit Motorola processors.",
    "mpu_strings": [
      "Gottlieb System 1"
    ]
  },
  {
    "slug": "gottlieb-system-80",
    "name": "Gottlieb System 80",
    "manufacturer": "gottlieb",
    "description": "Gottlieb's second major solid-state platform, introduced around 1980, switching to a Rockwell 6502 CPU. Games include Haunted House (1982), notable as the first three-level playfield pinball, and Black Hole (1981), the first multi-level pinball. The system used 6- and 7-digit numeric displays.",
    "mpu_strings": [
      "Gottlieb System 80"
    ]
  },
  {
    "slug": "gottlieb-system-80a",
    "name": "Gottlieb System 80A",
    "manufacturer": "gottlieb",
    "description": "An incremental update to Gottlieb's System 80, introduced around 1983, retaining the 6502 CPU but adding alphanumeric displays for more expressive scoring and messaging. Games include Rack 'Em Up (1983) and other mid-1980s Gottlieb/Mylstar titles.",
    "mpu_strings": [
      "Gottlieb System 80A"
    ]
  },
  {
    "slug": "gottlieb-system-80b",
    "name": "Gottlieb System 80B",
    "manufacturer": "gottlieb",
    "description": "A further evolution of the System 80 line, used from approximately 1985 to 1989, still 6502-based but with enhanced sound hardware featuring a Yamaha YM2151 synthesis chip and DAC for digitized speech. Notable games include Monte Carlo (1987) and Bone Busters Inc. (1989).",
    "mpu_strings": [
      "Gottlieb System 80B"
    ]
  },
  {
    "slug": "gottlieb-system-3",
    "name": "Gottlieb System 3",
    "manufacturer": "gottlieb",